"1","SheKnows, LLC, an Arizona limited liability company, and its affiliated companies, including StyleCaster, Inc., a Delaware corporation, and BlogHer Inc., a Delaware corporation (collectively, ""Company,"" ""we,"" or ""us""), knows that you care how information about you is used and shared. This Privacy Policy explains what information of yours will be collected by Company when you use the Website, any mobile versions of the Website, any applications published by the Company that you download from the Website or from a third-party, and other related services (the ""Service""), how the information will be used and how you can control the collection, correction and/or deletion of information. We will not use or share your information with anyone except as described in this Privacy Policy. To the extent that any terms of the Privacy Policy conflict with the terms of an existing written (including electronic) agreement between you and the Company regarding the use of specific areas of the Website or specific services (collectively, the ""Other Agreements""), the terms of such Other Agreements shall govern.  ","Receive/Shared with"
"3","Cookies Information: When you visit the Website, we may send one or more cookies - a small text file containing a string of alphanumeric characters - to your computer, mobile or other device (""Local Device Storage"") that uniquely identifies your browser or device and allows Company to help you log in faster and enhance your navigation through the Website. A cookie does not collect personal information about you from which your individual identity can be established. Company uses both session cookies and persistent cookies. A persistent cookie remains in your Local Device Storage after you close your browser. Persistent cookies may be used by your browser on subsequent visits to the Service. Persistent cookies can be removed by following your web browser's or Local Device Storage's directions. A session cookie is temporary and disappears after you close your browser. You can set your web browser to refuse all cookies or to indicate when a cookie is being sent. Therefore, some features of the Service may not function properly or at all if the ability to accept all cookies is disabled. Other cookies collect information about your browsing habits in order to help us and advertisers make suggestions relevant to you and your interests. They remember the websites you have visited and that information is shared with other parties such as advertisers. For example, we use third parties to provide you with more personalized advertisements when visiting other websites. You can change the settings on your browser or Local Device Storage to prevent cookies being stored on your Local Device Storage without your explicit consent. Your browser ""help"" section will normally provide details on how to manage the cookie settings.  ","Receive/Shared with"
"4","Social Networking: If you choose to access, visit and/or use any third-party social networking service(s) that may be integrated with the Service, we may receive personally identifiable information and other information about you and your computer, mobile and other device that you have made available to those services, including information about your contacts on those services. For example, some social networking services allow you to push content from our Service to your contacts or to pull information about your contacts so you can connect with them on or through our Service. Some social networking services also will facilitate your registration for our Service or enhance or personalize your experience on our Service. Your decision to use a social networking service in connection with our Service is voluntary. However, you should make sure you are comfortable with the information your third-party social networking services may make available to our Service by vising those services' privacy policies and/or modifying your privacy settings directly with those services. We reserve the right to use, transfer, assign, share and provide access to all personally identifiable information and other information about you and your computer, mobile or other device that we receive through third-party social networking services in the same ways described in this Privacy Policy as all of your other information.  ","Receive/Shared with"
"10","Any information or content that you voluntarily disclose for posting to the Service (for instance, in User Content you post on message boards, in chat areas, or leave a comment to an article) becomes available to the public. You should be aware that even if you remove User Content, copies may remain viewable in cached and archived pages or if other users have copied or stored your User Content.  ","See"
"12","Company may use certain information about you and/or your User Content without identifying you as an individual to third parties. We do this for purposes such as analyzing how the Service is used, diagnosing service or technical problems, maintaining security and personalizing advertisements and promotions.  ","Receive/Shared with"
"16","We may also allow access to our database by third parties that provide us with services, such as technical maintenance, market research, community and forums management, auction services, and shopping, personal/job search and other classified ads functionality, but only for the purpose of and to the extent necessary to provide those services. If you choose to purchase merchandise, products and/or services on or through features on the Service, we may forward your information to third parties for services such as credit card or other payment processing, order fulfillment, credit pre-authorization, and address verification. There are also times when you provide information about yourself to us in areas of the Service that may be managed or participated in by third parties. In such cases, the information may be used by us and by such third party(ies), each pursuant to its own policies. We may also provide your information to our advertisers, so that they can serve ads to you that meet your needs or match your interests. While we may seek to require such third parties to follow appropriate privacy policies and will not authorize them to use this information except for the express purpose for which it is provided, we do not bear any responsibility for any actions or policies of third parties.  ","Receive/Shared with"
"16","We may also allow access to our database by third parties that provide us with services, such as technical maintenance, market research, community and forums management, auction services, and shopping, personal/job search and other classified ads functionality, but only for the purpose of and to the extent necessary to provide those services. If you choose to purchase merchandise, products and/or services on or through features on the Service, we may forward your information to third parties for services such as credit card or other payment processing, order fulfillment, credit pre-authorization, and address verification. There are also times when you provide information about yourself to us in areas of the Service that may be managed or participated in by third parties. In such cases, the information may be used by us and by such third party(ies), each pursuant to its own policies. We may also provide your information to our advertisers, so that they can serve ads to you that meet your needs or match your interests. While we may seek to require such third parties to follow appropriate privacy policies and will not authorize them to use this information except for the express purpose for which it is provided, we do not bear any responsibility for any actions or policies of third parties.  ","Other"
"17","We reserve the right to access, use, and share with others your personally identifiable information for purposes of health, safety and other matters in the public interest.  ","Receive/Shared with"
"19","We reserve the right to use, transfer, sell and share aggregated, anonymous data about our users as a group for any lawful business purpose, such as analyzing usage trends and seeking compatible advertisers, sponsors, clients and customers.  ","Receive/Shared with"
"20","In addition, as our business changes, we may buy or sell various assets. In the event all or a portion of the assets owned or controlled by us, our parent or any subsidiary or affiliated entity are sold, assigned, transferred or acquired by another company, the information from and/or about our Service users may be among the transferred assets.  ","Receive/Shared with"
"20","In addition, as our business changes, we may buy or sell various assets. In the event all or a portion of the assets owned or controlled by us, our parent or any subsidiary or affiliated entity are sold, assigned, transferred or acquired by another company, the information from and/or about our Service users may be among the transferred assets.  ","Receive/Shared with"
"22"," How We Share Your Information    Personally Identifiable Information: Except as described in this Privacy Policy, Company will not rent or sell your personally identifiable information to others.  ","Receive/Shared with"
"22"," How We Share Your Information    Personally Identifiable Information: Except as described in this Privacy Policy, Company will not rent or sell your personally identifiable information to others.  ","Other"
"23","Company may share your personally identifiable information or information about your computer, mobile or other device with our affiliates and third parties solely for the purpose of providing services to you. We may store personal information in locations outside the direct control of Company (for instance, on servers or databases co-located with hosting providers).  ","Receive/Shared with"
"24","As we develop our business, we may buy or sell assets or business offerings. Customer, email and visitor information is generally one of the transferred business assets in these types of transactions. We may also transfer such information in the course of corporate divestitures, mergers or dissolution.  ","Receive/Shared with"
"24","As we develop our business, we may buy or sell assets or business offerings. Customer, email and visitor information is generally one of the transferred business assets in these types of transactions. We may also transfer such information in the course of corporate divestitures, mergers or dissolution.  ","Receive/Shared with"
"25","Except as otherwise described in this Privacy Policy, Company will not disclose personal information to any third party unless required to do so by law, regulation or subpoena or if we believe that such action is necessary to: (a) conform to the law, comply with legal process served on us or our affiliates or investigate, prevent or take action regarding suspected or actual illegal activities; (b) to enforce our Terms of Use, take precautions against liability, to investigate and defend ourselves against any third-party claims or allegations, to assist government enforcement agencies or to protect the security or integrity of our Website; and (c) to exercise or protect the rights, property or personal safety of Company, our users or others. Please note we may not provide notice prior to disclosure in such cases.  ","Receive/Shared with"
"25","Except as otherwise described in this Privacy Policy, Company will not disclose personal information to any third party unless required to do so by law, regulation or subpoena or if we believe that such action is necessary to: (a) conform to the law, comply with legal process served on us or our affiliates or investigate, prevent or take action regarding suspected or actual illegal activities; (b) to enforce our Terms of Use, take precautions against liability, to investigate and defend ourselves against any third-party claims or allegations, to assist government enforcement agencies or to protect the security or integrity of our Website; and (c) to exercise or protect the rights, property or personal safety of Company, our users or others. Please note we may not provide notice prior to disclosure in such cases.  ","Receive/Shared with"
"26","Non-Personally Identifiable Information: We may share non-personally identifiable information (such as anonymous usage data, referring/exit pages and URLs, platform types, number of clicks, etc.) with interested third parties to help them understand the usage patterns for certain Company services.  ","Receive/Shared with"
"27","Company allows other companies, called third-party ad servers or ad networks, to serve advertisements on the Website. These third-party ad servers or ad networks use technology to send, directly to your browser, the advertisements and links that appear on the Website. They automatically receive your IP address when this happens. They may also use other technologies (such as cookies, JavaScript or Web Beacons) to measure the effectiveness of their advertisements and to personalize the advertising content.  ","Track on first party website/app"
"27","Company allows other companies, called third-party ad servers or ad networks, to serve advertisements on the Website. These third-party ad servers or ad networks use technology to send, directly to your browser, the advertisements and links that appear on the Website. They automatically receive your IP address when this happens. They may also use other technologies (such as cookies, JavaScript or Web Beacons) to measure the effectiveness of their advertisements and to personalize the advertising content.  ","Receive/Shared with"
"27","Company allows other companies, called third-party ad servers or ad networks, to serve advertisements on the Website. These third-party ad servers or ad networks use technology to send, directly to your browser, the advertisements and links that appear on the Website. They automatically receive your IP address when this happens. They may also use other technologies (such as cookies, JavaScript or Web Beacons) to measure the effectiveness of their advertisements and to personalize the advertising content.  ","Collect on first party website/app"
"28","Company does not provide any personally identifiable information to these third-party ad servers or ad networks without your consent. However, please note that if an advertiser asks Company to show an advertisement to a certain audience and you respond to that advertisement, the advertiser or ad-server may conclude that you fit the description of the audience they are trying to reach.  ","Receive/Shared with"
"28","Company does not provide any personally identifiable information to these third-party ad servers or ad networks without your consent. However, please note that if an advertiser asks Company to show an advertisement to a certain audience and you respond to that advertisement, the advertiser or ad-server may conclude that you fit the description of the audience they are trying to reach.  ","Collect on first party website/app"
"36","You should also be aware that if you voluntarily disclose information (including personally identifiable information) on message boards or in chat areas, that information can be viewed publicly and can be collected and used by third parties without our knowledge and may result in unsolicited messages from other individuals or third parties. Such activities are beyond our control and outside the scope of this Privacy Policy.  ","See"
"36","You should also be aware that if you voluntarily disclose information (including personally identifiable information) on message boards or in chat areas, that information can be viewed publicly and can be collected and used by third parties without our knowledge and may result in unsolicited messages from other individuals or third parties. Such activities are beyond our control and outside the scope of this Privacy Policy.  ","Collect on first party website/app"
"38"," Third Party Advertisements and Technologies:    We use third-party advertising companies to serve advertisements when you visit the Website as is explained in detail in the Terms of Use. In the course of advertisements being served to you, a unique third-party cookie or other advertising technology may be placed on your browser. This advertising technology uses information derived from your visits to the Website to target advertising within this Website or on other websites. This information is used for many purposes, for example, it helps us try to ensure that you do not see the same advertisements over and over again. We also use this information to help select and display targeted advertisements that we believe may be of interest to you (sometimes called ""online behavioral advertising"" or ""interest-based advertising"" or ""OBA""). We also use web beacons, provided by third-party advertising companies, to help manage and optimize our online advertising. Web beacons enable us to recognize a browser's cookie when a browser visits this Website, to learn which banner ads bring users to our Website and to deliver more relevant advertising.  ","Track on first party website/app"
"38"," Third Party Advertisements and Technologies:    We use third-party advertising companies to serve advertisements when you visit the Website as is explained in detail in the Terms of Use. In the course of advertisements being served to you, a unique third-party cookie or other advertising technology may be placed on your browser. This advertising technology uses information derived from your visits to the Website to target advertising within this Website or on other websites. This information is used for many purposes, for example, it helps us try to ensure that you do not see the same advertisements over and over again. We also use this information to help select and display targeted advertisements that we believe may be of interest to you (sometimes called ""online behavioral advertising"" or ""interest-based advertising"" or ""OBA""). We also use web beacons, provided by third-party advertising companies, to help manage and optimize our online advertising. Web beacons enable us to recognize a browser's cookie when a browser visits this Website, to learn which banner ads bring users to our Website and to deliver more relevant advertising.  ","Track on first party website/app"
"38"," Third Party Advertisements and Technologies:    We use third-party advertising companies to serve advertisements when you visit the Website as is explained in detail in the Terms of Use. In the course of advertisements being served to you, a unique third-party cookie or other advertising technology may be placed on your browser. This advertising technology uses information derived from your visits to the Website to target advertising within this Website or on other websites. This information is used for many purposes, for example, it helps us try to ensure that you do not see the same advertisements over and over again. We also use this information to help select and display targeted advertisements that we believe may be of interest to you (sometimes called ""online behavioral advertising"" or ""interest-based advertising"" or ""OBA""). We also use web beacons, provided by third-party advertising companies, to help manage and optimize our online advertising. Web beacons enable us to recognize a browser's cookie when a browser visits this Website, to learn which banner ads bring users to our Website and to deliver more relevant advertising.  ","Collect on first party website/app"
"39","In addition, our advertisers or other third parties may use other third-party advertising technology to target advertising on the Website and other websites. We do not control the data collection and use practices of these other third parties. You should read the privacy notices of the websites you visit in order to determine what companies may be collecting information on those websites.  ","Track on first party website/app"
"39","In addition, our advertisers or other third parties may use other third-party advertising technology to target advertising on the Website and other websites. We do not control the data collection and use practices of these other third parties. You should read the privacy notices of the websites you visit in order to determine what companies may be collecting information on those websites.  ","Collect on first party website/app"
"39","In addition, our advertisers or other third parties may use other third-party advertising technology to target advertising on the Website and other websites. We do not control the data collection and use practices of these other third parties. You should read the privacy notices of the websites you visit in order to determine what companies may be collecting information on those websites.  ","Other"
