"17"," Business Partners and Other Third Parties    From time to time we allow companies whose products or services we feel may interest our print subscribers to advertise to those subscribers, using the names and addresses provided to us during the process of subscribing to the print edition. We do not share our subscribers names and addresses directly with these companies, however. In those instances, we use a reputable third party to administer the process on our behalf. Many of our subscribers find this a valuable and time-saving service. If you do not want your name and address to be shared for these purposes, you can opt-out of such sharing by e-mailing us at techtrouble(at)theatlantic(dot)com, or calling or writing us at the contact information provided.  ","Use","Third Party Sharing/Collection"
"21"," What Are Your Choices?    We believe you should have choices about the collection, use and sharing of your information. Although you cannot opt-out of all data collection when you visit our sites, you can limit the collection, use and sharing of your information.  ","Third party sharing/collection","User Choice/Control"
"22"," Collection of personally identifiable information    All personally identifiable information is provided on a voluntary basis. If you do not want The Atlantic to collect such information, you should not submit it to the Sites. However, doing so will restrict your ability to access some content and use some of the functionality of the sites.  ","First party collection","User Choice/Control"
"22"," Collection of personally identifiable information    All personally identifiable information is provided on a voluntary basis. If you do not want The Atlantic to collect such information, you should not submit it to the Sites. However, doing so will restrict your ability to access some content and use some of the functionality of the sites.  ","First party collection","User Choice/Control"
"23"," Sharing of personally identifiable information    You may opt-out of having your personally identifiable information shared with business partners and third parties for marketing and advertising purposes by e-mailing us at techtrouble(at)theatlantic(dot)com, or contacting us at the phone numbers or postal address provided below.  ","Third party sharing/collection","User Choice/Control"
"24"," Online, Interest Based Advertising    You may be able to opt-out of the use of your information for online, interest based advertising from participating whether advertising partners and unaffiliated third parties through the Network Advertising Initiatives opt-out program by clicking http://www.networkadvertising.org/managing/opt_out.asp.  ","Third party use","User Choice/Control"
"25"," Emails and Newsletters    You may always opt-out of receiving future e-mail marketing messages and newsletters from The Atlantic by following the instructions contained within the emails and newsletters, or by e-mailing, calling or writing us at the addresses below.  ","First party use","User Choice/Control"
"30"," Contests, Sweepstakes or Games    When we run a contest or sweepstakes or game relating to our Sites, it will be accompanied by a set of rules. The rules for each contest, sweepstakes or game will specify how the information gathered from you for entry will be used and disclosed if it is different than as described in this privacy policy. In conjunction with your entry in such contest or sweepstakes, personally identifiable information will be collected only if you voluntarily submit it.  ","Collection","First Party Collection/Use"
