"5","Welcome to Instagram (""Instagram,"" ""we,"" ""us"" or ""our""). Instagram provides a fast, beautiful and fun way for you to share media through our content-sharing platform. Just snap a photo, choose a filter to transform the look and feel, add comments (if you like) and share!   Our Privacy Policy explains how we and some of the companies we work with collect, use, share and protect information in relation to our mobile services, web site, and any software provided on or in connection with Instagram services (collectively, the ""Service""), and your choices about the collection and use of your information.  By using our Service you understand and agree that we are providing a platform for you to post content, including photos, comments and other materials (""User Content""), to the Service and to share User Content publicly. This means that other Users may search for, see, use, or share any of your User Content that you make publicly available through the Service, consistent with the terms and conditions of this Privacy Policy and our Terms of Use (which can be found at http://instagram.com/about/legal/terms/).  Our Policy applies to all visitors, users, and others who access the Service (""Users""). ","Receive/Shared with","Third Party Sharing/Collection"
"11","Analytics information:   We use third-party analytics tools to help us measure traffic and usage trends for the Service. These tools collect information sent by your device or our Service, including the web pages you visit, add-ons, and other information that assists us in improving the Service. We collect and use this analytics information with analytics information from other Users so that it cannot reasonably be used to identify any particular individual User. ","Other","Third Party Sharing/Collection"
"11","Analytics information:   We use third-party analytics tools to help us measure traffic and usage trends for the Service. These tools collect information sent by your device or our Service, including the web pages you visit, add-ons, and other information that assists us in improving the Service. We collect and use this analytics information with analytics information from other Users so that it cannot reasonably be used to identify any particular individual User. ","Receive/Shared with","Third Party Sharing/Collection"
"12","Cookies and similar technologies:   When you visit the Service, we may use cookies and similar technologies like pixels, web beacons, and local storage to collect information about how you use Instagram and provide features to you.  We may ask advertisers or other partners to serve ads or services to your devices, which may use cookies or similar technologies placed by us or the third party.  More information is available in our About Cookies section ","Collect on first party website/app","Third Party Sharing/Collection"
"14","Device identifiers:   When you use a mobile device like a tablet or phone to access our Service, we may access, collect, monitor, store on your device, and/or remotely store one or more ""device identifiers."" Device identifiers are small data files or similar data structures stored on or associated with your mobile device, which uniquely identify your mobile device. A device identifier may be data stored in connection with the device hardware, data stored in connection with the device's operating system or other software, or data sent to the device by Instagram.  A device identifier may deliver information to us or to a third party partner about how you browse and use the Service and may help us or others provide reports or personalized content and ads. Some features of the Service may not function properly if use or availability of device identifiers is impaired or disabled. ","Other","Third Party Sharing/Collection"
"17"," 3. SHARING OF YOUR INFORMATION    We will not rent or sell your information to third parties outside Instagram (or the group of companies of which Instagram is a part) without your consent, except as noted in this Policy.  ","Receive/Shared with","Third Party Sharing/Collection"
"19","We may share User Content and your information (including but not limited to, information from cookies, log files, device identifiers, location data, and usage data) with businesses that are legally part of the same group of companies that Instagram is part of, or that become part of that group (""Affiliates""). Affiliates may use this information to help provide, understand, and improve the Service (including by providing analytics) and Affiliates' own services (including by providing you with better and more relevant experiences). But these Affiliates will honor the choices you make about who can see your photos. ","Receive/Shared with","Third Party Sharing/Collection"
"20","We also may share your information as well as information from tools like cookies, log files, and device identifiers and location data, with third-party organizations that help us provide the Service to you (""Service Providers""). Our Service Providers will be given access to your information as is reasonably necessary to provide the Service under reasonable confidentiality terms. ","Receive/Shared with","Third Party Sharing/Collection"
"20","We also may share your information as well as information from tools like cookies, log files, and device identifiers and location data, with third-party organizations that help us provide the Service to you (""Service Providers""). Our Service Providers will be given access to your information as is reasonably necessary to provide the Service under reasonable confidentiality terms. ","Receive/Shared with","Third Party Sharing/Collection"
"21","We may also share certain information such as cookie data with third-party advertising partners. This information would allow third-party ad networks to, among other things, deliver targeted advertisements that they believe will be of most interest to you. ","Receive/Shared with","Third Party Sharing/Collection"
"22","We may remove parts of data that can identify you and share anonymized data with other parties. We may also combine your information with other information in a way that it is no longer associated with you and share that aggregated information. ","Receive/Shared with","Third Party Sharing/Collection"
"23","Parties with whom you may choose to share your User Content:   Any information or content that you voluntarily disclose for posting to the Service, such as User Content, becomes available to the public, as controlled by any applicable privacy settings that you set. To change your privacy settings on the Service, please change your profile setting. Once you have shared User Content or made it public, that User Content may be re-shared by others.  Subject to your profile and privacy settings, any User Content that you make public is searchable by other Users and subject to use under our Instagram API. The use of the Instagram API is subject to the API Terms of Use which incorporates the terms of this Privacy Policy.  If you remove information that you posted to the Service, copies may remain viewable in cached and archived pages of the Service, or if other Users or third parties using the Instagram API have copied or saved that information. ","Receive/Shared with","Third Party Sharing/Collection"
"23","Parties with whom you may choose to share your User Content:   Any information or content that you voluntarily disclose for posting to the Service, such as User Content, becomes available to the public, as controlled by any applicable privacy settings that you set. To change your privacy settings on the Service, please change your profile setting. Once you have shared User Content or made it public, that User Content may be re-shared by others.  Subject to your profile and privacy settings, any User Content that you make public is searchable by other Users and subject to use under our Instagram API. The use of the Instagram API is subject to the API Terms of Use which incorporates the terms of this Privacy Policy.  If you remove information that you posted to the Service, copies may remain viewable in cached and archived pages of the Service, or if other Users or third parties using the Instagram API have copied or saved that information. ","Receive/Shared with","Third Party Sharing/Collection"
"23","Parties with whom you may choose to share your User Content:   Any information or content that you voluntarily disclose for posting to the Service, such as User Content, becomes available to the public, as controlled by any applicable privacy settings that you set. To change your privacy settings on the Service, please change your profile setting. Once you have shared User Content or made it public, that User Content may be re-shared by others.  Subject to your profile and privacy settings, any User Content that you make public is searchable by other Users and subject to use under our Instagram API. The use of the Instagram API is subject to the API Terms of Use which incorporates the terms of this Privacy Policy.  If you remove information that you posted to the Service, copies may remain viewable in cached and archived pages of the Service, or if other Users or third parties using the Instagram API have copied or saved that information. ","Other","Third Party Sharing/Collection"
"23","Parties with whom you may choose to share your User Content:   Any information or content that you voluntarily disclose for posting to the Service, such as User Content, becomes available to the public, as controlled by any applicable privacy settings that you set. To change your privacy settings on the Service, please change your profile setting. Once you have shared User Content or made it public, that User Content may be re-shared by others.  Subject to your profile and privacy settings, any User Content that you make public is searchable by other Users and subject to use under our Instagram API. The use of the Instagram API is subject to the API Terms of Use which incorporates the terms of this Privacy Policy.  If you remove information that you posted to the Service, copies may remain viewable in cached and archived pages of the Service, or if other Users or third parties using the Instagram API have copied or saved that information. ","Other","Third Party Sharing/Collection"
"24","What happens in the event of a change of control:   If we sell or otherwise transfer part or the whole of Instagram or our assets to another organization (e.g., in the course of a transaction like a merger, acquisition, bankruptcy, dissolution, liquidation), your information such as name and email address, User Content and any other information collected through the Service may be among the items sold or transferred. You will continue to own your User Content. The buyer or transferee will have to honor the commitments we have made in this Privacy Policy. ","Other","Third Party Sharing/Collection"
"24","What happens in the event of a change of control:   If we sell or otherwise transfer part or the whole of Instagram or our assets to another organization (e.g., in the course of a transaction like a merger, acquisition, bankruptcy, dissolution, liquidation), your information such as name and email address, User Content and any other information collected through the Service may be among the items sold or transferred. You will continue to own your User Content. The buyer or transferee will have to honor the commitments we have made in this Privacy Policy. ","Receive/Shared with","Third Party Sharing/Collection"
"25","Responding to legal requests and preventing harm:   We may access, preserve and share your information in response to a legal request (like a search warrant, court order or subpoena) if we have a good faith belief that the law requires us to do so. This may include responding to legal requests from jurisdictions outside of the United States where we have a good faith belief that the response is required by law in that jurisdiction, affects users in that jurisdiction, and is consistent with internationally recognized standards. We may also access, preserve and share information when we have a good faith belief it is necessary to: detect, prevent and address fraud and other illegal activity; to protect ourselves, you and others, including as part of investigations; and to prevent death or imminent bodily harm. Information we receive about you may be accessed, processed and retained for an extended period of time when it is the subject of a legal request or obligation, governmental investigation, or investigations concerning possible violations of our terms or policies, or otherwise to prevent harm. ","Receive/Shared with","Third Party Sharing/Collection"
"25","Responding to legal requests and preventing harm:   We may access, preserve and share your information in response to a legal request (like a search warrant, court order or subpoena) if we have a good faith belief that the law requires us to do so. This may include responding to legal requests from jurisdictions outside of the United States where we have a good faith belief that the response is required by law in that jurisdiction, affects users in that jurisdiction, and is consistent with internationally recognized standards. We may also access, preserve and share information when we have a good faith belief it is necessary to: detect, prevent and address fraud and other illegal activity; to protect ourselves, you and others, including as part of investigations; and to prevent death or imminent bodily harm. Information we receive about you may be accessed, processed and retained for an extended period of time when it is the subject of a legal request or obligation, governmental investigation, or investigations concerning possible violations of our terms or policies, or otherwise to prevent harm. ","Receive/Shared with","Third Party Sharing/Collection"
"28","Instagram, its Affiliates, or Service Providers may transfer information that we collect about you, including personal information across borders and from your country or jurisdiction to other countries or jurisdictions around the world. If you are located in the European Union or other regions with laws governing data collection and use that may differ from U.S. law, please note that we may transfer information, including personal information, to a country and jurisdiction that does not have the same data protection laws as your jurisdiction. ","Receive/Shared with","Third Party Sharing/Collection"
