"5"," what information we collect     registration information    When you create an account, you are required to provide a username and password, and may opt to provide an email address. We also log, and retain indefinitely, the IP address from which the account is initially created.  ","Explicit","First Party Collection/Use"
"6"," Post, Comment and Messaging Data    The posts and comments you make on reddit are not private, even if made to a subreddit not readily accessible to the public. This means that, by default, they are not deleted from our servers ever and will still be accessible after your account is deleted. However, we only save the most recent version of comments and posts, so your previous edits, once overwritten, are no longer available.  ","Explicit","First Party Collection/Use"
"6"," Post, Comment and Messaging Data    The posts and comments you make on reddit are not private, even if made to a subreddit not readily accessible to the public. This means that, by default, they are not deleted from our servers ever and will still be accessible after your account is deleted. However, we only save the most recent version of comments and posts, so your previous edits, once overwritten, are no longer available.  ","Implicit","First Party Collection/Use"
"7","Your messages are generally only viewable by the parties involved, but they may be accessed internally as needed for community support. Moreover, we keep a complete log of all messages sent on our service, even when both parties later delete their accounts.  ","Explicit","First Party Collection/Use"
"7","Your messages are generally only viewable by the parties involved, but they may be accessed internally as needed for community support. Moreover, we keep a complete log of all messages sent on our service, even when both parties later delete their accounts.  ","Implicit","First Party Collection/Use"
"8","reddit stores the IP addresses associated with specific posts, comments, and private messages for 90 days after they are made or sent.  ","Implicit","First Party Collection/Use"
"9"," reddit gold    If you choose to upgrade to reddit gold, this status will be stored on your profile, along with the transaction number associated with the payment and the recipient of any gold you send. Although Stripe and PayPal send us a receipt with your name and email address if you provide it, we don't add that information to your account. However, reddit does not handle or have access to any of your payment information. For questions about how this information is stored and used, please read our third party partners privacy policies.  ","Implicit","First Party Collection/Use"
"10"," log data    Log data is certain information that is automatically collected by our systems when you visit reddit, including the type of software used to access the site (browser, operating system), the type of device you are using, the address of the external or internal page that referred you, and your IP address. This information is recorded for all visitors and is only linked to your account if you are signed in. Except for the IP address you use to create the account, all IP addresses will be deleted from our servers after 90 days.  ","Implicit","First Party Collection/Use"
"10"," log data    Log data is certain information that is automatically collected by our systems when you visit reddit, including the type of software used to access the site (browser, operating system), the type of device you are using, the address of the external or internal page that referred you, and your IP address. This information is recorded for all visitors and is only linked to your account if you are signed in. Except for the IP address you use to create the account, all IP addresses will be deleted from our servers after 90 days.  ","Implicit","First Party Collection/Use"
"11"," activity information    We collect information about how all visitors browse the site to make reddit better. We remove personally identifiable data from this information after 90 days.  ","Implicit","First Party Collection/Use"
"12"," other information related to your account    When you are logged into your reddit account, we save the following information about your preferences and your interactions with the site to allow you to customize your experience: subscriptions, preferred language, all languages you see content in, accumulated karma, voting data, and date of last login. You may also opt to add ""flair"" to decorate your profile, and this will be stored as well.  ","Explicit","First Party Collection/Use"
"12"," other information related to your account    When you are logged into your reddit account, we save the following information about your preferences and your interactions with the site to allow you to customize your experience: subscriptions, preferred language, all languages you see content in, accumulated karma, voting data, and date of last login. You may also opt to add ""flair"" to decorate your profile, and this will be stored as well.  ","Implicit","First Party Collection/Use"
"13"," how we use or disclose collected information     our use of your information is limited to improving your experience    It takes a lot of work to keep our site running and prevent abuse, and we sometimes use your data in order to facilitate this. Your information is used internally only where necessary to provide our services. For instance, we keep IP addresses for 90 days in order to investigate issues with our site, track and block suspected spammers, and otherwise maintain the integrity of the community.  ","Implicit","First Party Collection/Use"
"18"," cookie policy     technologies we use    Cookies are small data files placed on your computer by websites you visit in order to help them remember certain information about you. At reddit, we set only a few cookies for tracking user preferences, authentication, and collecting anonymous analytics data. Additionally, our advertising partners set cookies. We also use pixel trackers, which are images embedded in a webpage, for the purpose of measuring and analyzing usage and activity. Each of these uses is described in greater detail below.  ","Implicit","First Party Collection/Use"
"18"," cookie policy     technologies we use    Cookies are small data files placed on your computer by websites you visit in order to help them remember certain information about you. At reddit, we set only a few cookies for tracking user preferences, authentication, and collecting anonymous analytics data. Additionally, our advertising partners set cookies. We also use pixel trackers, which are images embedded in a webpage, for the purpose of measuring and analyzing usage and activity. Each of these uses is described in greater detail below.  ","Implicit","First Party Collection/Use"
"20"," preference cookies    If you are logged out, reddit will place a simple cookie to remember if you indicate you would like to view over 18 content, or if you set a language preference. Additionally, if you vote an advertisement up or down, our third-party advertising partner, Adzerk, will set a cookie to remember your ad preferences.  ","Implicit","First Party Collection/Use"
"21","reddit.tv will place a simple cookie to remember your channel choices, which includes the subreddits you choose as channels and how they are arranged, and your playback preferences including vote sort, autoplay, shuffle, NSFW/SFW, and whether annotations will be visible.  ","Implicit","First Party Collection/Use"
"22"," authentication cookies    When you log into your account, reddit will place a cookie for the sole purpose of creating this session. It contains your user id and hashed authentication information.  ","Implicit","First Party Collection/Use"
"22"," authentication cookies    When you log into your account, reddit will place a cookie for the sole purpose of creating this session. It contains your user id and hashed authentication information.  ","Implicit","First Party Collection/Use"
"23"," analytics cookies    We use a tool called Google Analytics to help us understand how users interact with our website. It tells us aggregate usage and traffic information, such as how the site was accessed, how long visitors stayed, and the number of first-time visitors to the site. To learn more about Google Analytics and how it uses your data, please visit http://www.google.com/analytics/learn/privacy.html.  ","Implicit","First Party Collection/Use"
"24","We also place our own session cookie, which contains the date the cookie was set and a unique identifier. This data is anonymized, never associated with your reddit account (whether you are logged-in or not), and follows the requirements laid out in the What Information We Collect section of this policy. By knowing how people use the site, we can make it better.  ","Implicit","First Party Collection/Use"
"25"," pixel data    We use small image files called web pixels to collect activity information to help understand how people use the service so we can make it better. We use this information internally only, and we remove information that could be used to identify an individual user after 90 days. We only link this information to your reddit account when you are signed in.  ","Implicit","First Party Collection/Use"
"26"," disabling cookies    Most browsers include an option to clear existing cookies or reject new ones. However, if you do this, portions of the reddit website may not function as intended.  ","Implicit","First Party Collection/Use"
"42"," user information we collect    Our Apps collect the same user information as described in the What Information We Collect section of this privacy policy.  ","Implicit","First Party Collection/Use"
"43"," activity and device information    Our apps collect certain information about your device, including its IP address, device type, and its current operating system. This information is used for analytics and to improve the reddit service; for example, we use device and OS information to track and fix bugs. It is also used to provide advertising as described below. All stored IP addresses, except the account creation IP address, are deleted after 90 days. We only associate this information with your account when you are signed in.  ","Implicit","First Party Collection/Use"
"45","We do not associate your devices unique advertising identifier with your user account, even if you are signed in on an app.  ","Implicit","First Party Collection/Use"
"46"," opting out    While we have very high standards for the types of ads we show, we also want to make it easy for you to opt out of sending your device's unique advertising identifier to us. To opt out on Android and iOS, please follow these instructions.  ","Implicit","First Party Collection/Use"
"47"," how reddit uses and discloses app information    reddit only uses and discloses your information for the same limited set of purposes and circumstances that we describe in the How We Use or Disclose Collected Information section of this privacy policy.  ","Implicit","First Party Collection/Use"
