"4"," Information You Provide Directly To Us:    We may ask you to provide your personal information, demographic information or information about your preferences or interests when you:     Register for an account on the Sites     Sign up to receive email newsletters from us     Make a purchase on the Sites     Enter a contest or sweepstakes     Participate in surveys or special promotions     Participate on social media accounts involving our authors, books or brands     Participate in communities or forums on the Sites     Submit user generated content on any part of the Sites that permit it     Knowingly volunteer information on any other part of the Sites (e.g., request for customer service, submit a job application)  ","Explicit","First Party Collection/Use"
"4"," Information You Provide Directly To Us:    We may ask you to provide your personal information, demographic information or information about your preferences or interests when you:     Register for an account on the Sites     Sign up to receive email newsletters from us     Make a purchase on the Sites     Enter a contest or sweepstakes     Participate in surveys or special promotions     Participate on social media accounts involving our authors, books or brands     Participate in communities or forums on the Sites     Submit user generated content on any part of the Sites that permit it     Knowingly volunteer information on any other part of the Sites (e.g., request for customer service, submit a job application)  ","Explicit","First Party Collection/Use"
"5"," Information Collected Using Technology:    In addition to any information you provide directly to us, we and our third party service providers may use a variety of technologies that automatically collect certain non-personal information when you interact with the Sites or emails sent to you, including the following:  ","Implicit","First Party Collection/Use"
"8"," Location Information    Some of our applications may deliver content based on your current location if you choose to enable that feature of the app. If you enable the location-based feature, your current location will be stored locally on your device, which will then be used by the app. If you elect to have a location-based search saved to your history, we will store that information on our servers. If you do not enable the location-based service, or if an app does not have that feature, the app will not transmit to us, and we will not collect or store, location information.  ","Explicit","First Party Collection/Use"
"8"," Location Information    Some of our applications may deliver content based on your current location if you choose to enable that feature of the app. If you enable the location-based feature, your current location will be stored locally on your device, which will then be used by the app. If you elect to have a location-based search saved to your history, we will store that information on our servers. If you do not enable the location-based service, or if an app does not have that feature, the app will not transmit to us, and we will not collect or store, location information.  ","Explicit","First Party Collection/Use"
"9"," Cookies, Flash Cookies and Web Beacons    Like many websites, we use cookies, flash cookies, web beacons or similar technologies. ""Cookies"" are small text files that are stored on your computer or other device when you visit certain online pages that record your preferences and actions. We use cookies for a variety of purposes, including remembering you and your preferences, tracking your use of our Sites, and facilitating your payment transactions. Most web browsers automatically accept cookies, but, if you prefer, you can usually modify your browser setting to decline cookies. However, please note that refusing a cookie may limit your access to the Sites.  ","Implicit","First Party Collection/Use"
"9"," Cookies, Flash Cookies and Web Beacons    Like many websites, we use cookies, flash cookies, web beacons or similar technologies. ""Cookies"" are small text files that are stored on your computer or other device when you visit certain online pages that record your preferences and actions. We use cookies for a variety of purposes, including remembering you and your preferences, tracking your use of our Sites, and facilitating your payment transactions. Most web browsers automatically accept cookies, but, if you prefer, you can usually modify your browser setting to decline cookies. However, please note that refusing a cookie may limit your access to the Sites.  ","Implicit","First Party Collection/Use"
"11","A ""web beacon"" (also known as an ""action tag"", ""tracer tag"", or ""single-pixel GIF"") is an invisible graphic that is programmed only to collect non-personal information about your use of our Sites or emails sent to you. Web beacons may be used for a number of purposes, including counting visitors to the Sites, monitoring how users navigate the Sites, counting how many emails were opened or how many links were viewed, and providing you with content customized to your interests.  ","Implicit","First Party Collection/Use"
"12"," Targeted Advertising    We may allow third parties to use cookies, web beacons and similar technologies to better understand your behavior and browsing activities, so that we can serve you targeted advertising while you are on our Sites and display our ads to you when you visit other third party sites. For example, we work with third party network advertisers who may set these technologies to better provide advertisements about goods and services that may be of interest to you. We do not control these third party technologies, and they are not subject to this Privacy Policy. We do not authorize these third party network advertisers to use this technology to collect personal information about you and they do not have access to your personal information from us. They may, however, track your Internet usage anonymously (that is, without being able to identify you personally) over time and across other websites in their networks beyond our Sites. To learn more about the use of this information or to opt out of having this information used by our third party network advertisers, please visit the Network Advertising Initiative by clicking http://www.networkadvertising.org/managing/opt_out.asp.  ","Implicit","First Party Collection/Use"
"14"," Collection of Information From Other Third Party Sources    We may also collect personal and non-personal information about you from other sources to, among other things, enable us to supplement the information contained in our database and to better customize your experience with PRH.  ","Implicit","First Party Collection/Use"
"25"," Social Media    Our Sites may provide you with the ability to register, log into, ""like"" or otherwise interact with third party social media services, including, but not limited to, Facebook, Instagram, Twitter, Pinterest, YouTube, and other social media services. These features may enable integration and/or access to your social media accounts. We do not control these social media services or your profiles on these services, and we do not establish privacy settings or rules for how your personal information on these services will be used. If you choose to log on to or submit information through any of these social media services, your personal information will be subject to the applicable social media service's terms and conditions and your current privacy settings on such social media service. By accessing any social media service, you will be assuming the risk that the personal information you provide on that service may be viewed and/or used by third parties for any purpose. You agree that we are not responsible for any acts or omissions by these social media service providers.  ","Implicit","First Party Collection/Use"
"26","In addition, by choosing to log in to our Sites using your credentials from a social media service, you are asking that service to send us certain information from your account with the service, and you authorize us to collect, store and use such information in accordance with this Privacy Policy.  ","Explicit","First Party Collection/Use"
"29","Email address: We may collect a child's email address in order to respond to a one-time request from the child, such as if the child asks us or one of our authors a question. In such case, we promptly delete the child's email address from our system once we have responded, and we do not use the child's email address for any other purpose.  ","Explicit","First Party Collection/Use"
"31","Email newsletters: We may collect a child's email address if the child wishes to sign up for our email newsletters. In such instance, the child will be asked to provide his or her email address and the email address of his or her parent/guardian. We will send the child's parent/guardian a notification email informing them of the child's request to receive the newsletter by email on an ongoing basis and give the parent/guardian the option to have his or her child's information removed from our newsletter database. If the newsletter is declined, we will not send the newsletter and will delete any related personal information collected in the sign-up process from our files. If the newsletter is not declined, we will send the newsletter. All newsletters contain instructions so that the recipient may unsubscribe at any time.  ","Explicit","First Party Collection/Use"
"32","Contests or Sweepstakes: We may collect a child's email address to enter the child in a sweepstakes or contest or to notify the child that he or she has won or lost a contest or sweepstakes or contest. We will not keep the child's email address after the promotion or use the child's email address for any other purpose other than for the promotion. For certain promotions, we may ask that a child give us his/her parent's email address so we can obtain more personalized information for prize fulfillment purposes if the child wins the promotion or to notify the parent if we need more than the child's email address to enter the child in the promotion. In the latter event, parents will be sent a notice along with instructions on how they may provide their consent for their child to participate in such promotion.  ","Explicit","First Party Collection/Use"
"33","We may also collect anonymous information automatically from your child's computer or device, such as the frequency with which the child visits our Site and the pages visited, to support the internal operations of the Site. We collect this information so we can understand and monitor usage of the Site, customize content on the Site and improve the performance of the Site. This information is collected using technologies such as cookies, flash cookies, web beacons, and similar technologies. This information is not used to behaviorally target children and we do not permit behavioral targeting on any of our Sites that are directed to children.  ","Implicit","First Party Collection/Use"
"33","We may also collect anonymous information automatically from your child's computer or device, such as the frequency with which the child visits our Site and the pages visited, to support the internal operations of the Site. We collect this information so we can understand and monitor usage of the Site, customize content on the Site and improve the performance of the Site. This information is collected using technologies such as cookies, flash cookies, web beacons, and similar technologies. This information is not used to behaviorally target children and we do not permit behavioral targeting on any of our Sites that are directed to children.  ","Implicit","First Party Collection/Use"
