"18","HOW WE USE YOUR INFORMATION   Personally identifying information that we collect for a particular promotional purpose through one of our websites or to make a purchase from the PlayStation Shop is saved and used only for that purpose, unless the participant chooses to opt-in to one of our marketing programs. Visitors to our websites may be given the opportunity to ""opt-in"" to two different programs. The first option is to receive marketing content from SCEA. The second is to have personal information shared with SCEA's third party partners so that they may send you marketing materials.  ","Marketing"
"18","HOW WE USE YOUR INFORMATION   Personally identifying information that we collect for a particular promotional purpose through one of our websites or to make a purchase from the PlayStation Shop is saved and used only for that purpose, unless the participant chooses to opt-in to one of our marketing programs. Visitors to our websites may be given the opportunity to ""opt-in"" to two different programs. The first option is to receive marketing content from SCEA. The second is to have personal information shared with SCEA's third party partners so that they may send you marketing materials.  ","Perform service"
"22","Email addresses collected from consumers during the use of the E-Cards or ""Send-to-a-Friend"" email feature on our websites are not retained by us, and are only used to send a one-time email notification on a consumer's behalf.  ","Perform service"
"24","SCEA's consumer services department maintains information obtained from consumers who contact or submit an online complaint so that we may assist these customers with current or future service issues. SCEA's consumer services department may collect additional information such as credit card, personal check information, if a consumer contacts consumer services to request repair of, exchange of, or service on, a PlayStation system. Consumer Services uses this information only for payment and payment verification purposes. SCEA's consumer services department may direct consumers to the consumer services departments of other companies with whom SCEA has arranged to provide consumer service, so that the consumer receives appropriate assistance.  ","Perform service"
"40","Retention Policy   We will retain personally identifying information about you for the period necessary to fulfill the purposes outlined in this policy unless a longer retention period is required by law or regulations.  ","Perform service"
"40","Retention Policy   We will retain personally identifying information about you for the period necessary to fulfill the purposes outlined in this policy unless a longer retention period is required by law or regulations.  ","Other"
